Category,Name,Description,PowerLevel
Equipment,Copper Cloud Staff,"A sturdy bronze staff that produces a whooshing sound when swung, ideal for close-range combat.",85
Equipment,Hundred Performances Coin-Lined Robe,"A finely crafted battle armor that provides powerful defense and resistance against poison damage.",90
Skill,Heavenly Thunder Strike,"Summons heavenly thunder to strike enemies, dealing large-area lightning damage.",95
Skill,Flame Dance,"Unleashes a fiery dance technique, enveloping enemies in scorching flames.",92
Character,Sun Wukong,"The protagonist, possessing the Seventy-Two Transformations and the ability to ride the clouds, a champion of justice.",100
Character,Silver Horn King,"One of the powerful demon kings, skilled at manipulating various magical treasures with exceptionally high combat prowess.",88
